{
  "policyOutcome": "deny_no_permission",
  "receiptStatus": "rejected_policy",
  "reasonCodes": [
    {
      "code": "ERR_PRIVATE_NO_COPY",
      "scope": "policy",
      "mustExist": true
    }
  ],
  "persistedArtifacts": {
    "activities": [
      "policy_decision"
    ],
    "claims": [
      "transfer_claim"
    ],
    "receipts": [
      "transfer_receipt"
    ],
    "decisions": [
      "policy_decision"
    ]
  },
  "auditEvents": [
    {
      "phase": "copy_control",
      "status": "notice_replaced",
      "reasonCode": "ERR_PRIVATE_NO_COPY"
    }
  ]
}
