{
  "policyOutcome": "allow_with_attribution",
  "receiptStatus": "accepted_with_attribution_required",
  "reasonCodes": [
    {
      "code": "WARN_HTML_FALLBACK_LOW_CONFIDENCE",
      "scope": "bundle",
      "mustExist": true
    }
  ],
  "persistedArtifacts": {
    "activities": [
      "paste"
    ],
    "claims": [
      "transfer_claim"
    ],
    "receipts": [
      "transfer_receipt"
    ],
    "decisions": [
      "policy_decision"
    ]
  },
  "auditEvents": [
    {
      "phase": "parse",
      "status": "fallback",
      "reasonCode": "WARN_HTML_FALLBACK_LOW_CONFIDENCE"
    }
  ]
}
